Maschine;Universelles mathematisches Objekt;Meta-Physik-Teilchen;Meta-Physik-Teilchen;Meta-Physik-Teilchen;Meta-Physik-Teilchen;
Automatisierung und Technologie;Der Funktor aber nicht die Funktion;33;AG;45;AS;Grundlegende daraus entstehendes Netzwerk der Automatisierung und Technologie
Robotter Androiden;Vielleicht möglicherweise oder nicht Der differential-Funktor (Differential Functor / Tangent Functor);44;AR;60;BH;Vernetzung innerhalb von Androiden und Robottern
Künstliche Intelligenz;Künstliche Intelligenz - Kausalketten – mäßig verändern stufenweise oder anders und ggf. reagieren können.;55;BC;75;BW;Art des Netzwerkes, welches bei durch von mit künstlicher Intelligenz entwickelt wird
z.B. Bilder morphen mit so etwas wie künstlicher intelligenz schlau wandeln änden irgendetwas;Sozusagen mehr oder weniger eine künstliche Intelligenz, aber statt Kausal Ketten – mäßig funktionierend stattdessen skalierend;66;BN;90;CL;Netzwerk innerhalb Morphenden vergleichbar etwa künstlichen Intelligenzen ähnlichen Programmiertechnischen Gestaltungen für Gestaltungen oder was auch immer sonstiges
Kreative Maschine und navigierende und regierende richtungsweisende Maschine zur Unterstütung von politischen Entscheidungen;Universelles Navigationsgerät;77;BY;105;DA;Universelles Navigationsgerät durch die Interpretationen Multiplikationen von Dreieck Drei C E Fünf Pentagramm E G Sieben Heptagramm Septagramm
So jemand mit einer Fields Medaille wurde obdachlos gemacht und in der Zeitung meinte man, er will gar nicht das Geld. Guter Typ. Geil Happy gut.;Sieben Spalten hat die Tabelle;Eine Zeile Überschrift, Fünf Spalten Inhalte, Eine Spalte das hier. Kann dennoch editiert werden, dass das anders sei. Wettrüsten mache ich nicht.;;;;
